{
  "schemaVersion": "1.0.0",
  "projectId": "projectos",
  "activePlanId": "plan-2aaafbc8388797b8-a9bb5ea68e25",
  "activePlanVersion": "1.15",
  "currentStatus": "IN EXECUTION",
  "completionMethod": "phase-closure",
  "acceptedPhaseCount": 6,
  "totalPhaseCount": 8,
  "completionPercentage": 75,
  "completedPhases": [
    "PROJECTOS-FINISH-WRITEPATHS1A",
    "PROJECTOS-FINISH-MULTIPROJECT1A",
    "PROJECTOS-FINISH-API-GATEKEEPER1A",
    "PROJECTOS-FINISH-EXTERNAL-PROOF1A",
    "PROJECTOS-FINISH-ZERO-TOUCH-CLOSURE1A",
    "PROJECTOS-FINISH-EXTERNAL-PROOF2A"
  ],
  "activePhase": "PROJECTOS-FINISH-CONTINUE-INTEGRITY1A",
  "pendingPhases": [
    "PROJECTOS-FINISH-EXTERNAL-PROOF3A"
  ],
  "blockedPhases": [],
  "deferredPhases": [],
  "acceptedCarryForward": [],
  "currentBranch": "projectos-autonomy-bootstrap1a",
  "currentHead": "e4afff6bd157b9492e63c0f685db1695b8fd5da1",
  "currentRemoteHead": null,
  "workingTreeStatus": "dirty",
  "currentRisks": [],
  "currentBlockers": [],
  "lastEvidenceReference": "plan-approval decision PLANDEC-58c014828bd0d664975bd1d0",
  "nextRecommendedPhase": "PROJECTOS-FINISH-CONTINUE-INTEGRITY1A",
  "lastUpdated": "2026-10-26T10:55:52.558Z",
  "updatedByRole": "implementer"
}
