{
  "schemaVersion": "1.0.0",
  "projectId": "projectos",
  "activePlanId": "projectos-autonomous-self-hosting-plan",
  "activePlanVersion": "1.0",
  "currentStatus": "PLAN READY",
  "completionMethod": "phase-closure",
  "acceptedPhaseCount": 0,
  "totalPhaseCount": 1,
  "completionPercentage": 0,
  "completedPhases": [],
  "activePhase": "PROJECTOS-AUTONOMOUS-GATEKEEPER-LOOP1A",
  "pendingPhases": [],
  "blockedPhases": [],
  "deferredPhases": [],
  "acceptedCarryForward": [],
  "currentBranch": "projectos-post-v3-selfhost-pilot1a",
  "currentHead": "7a6062244f8fd0d7ecd98df5801df27a72a5fab0",
  "currentRemoteHead": null,
  "workingTreeStatus": "dirty",
  "currentRisks": [],
  "currentBlockers": [],
  "lastEvidenceReference": "plan-approval decision PROJECTOS-AUTONOMOUS-SELF-HOSTING-PLAN-APPROVAL-DECISION1B",
  "nextRecommendedPhase": "PROJECTOS-AUTONOMOUS-GATEKEEPER-LOOP1A",
  "lastUpdated": "2026-08-17T13:25:32.814Z",
  "updatedByRole": "implementer"
}
