{
  "schemaVersion": "1.0.0",
  "projectId": "projectos",
  "activePlanId": "plan-fe8eccbbe2de4125-43057564704a",
  "activePlanVersion": "1.19",
  "currentStatus": "PLAN READY",
  "completionMethod": "phase-closure",
  "acceptedPhaseCount": 0,
  "totalPhaseCount": 17,
  "completionPercentage": 0,
  "completedPhases": [],
  "activePhase": null,
  "pendingPhases": [
    "PROJECTOS-FINISH-WRITEPATHS1A",
    "PROJECTOS-FINISH-MULTIPROJECT1A",
    "PROJECTOS-FINISH-API-GATEKEEPER1A",
    "PROJECTOS-FINISH-EXTERNAL-PROOF1A",
    "PROJECTOS-FINISH-ZERO-TOUCH-CLOSURE1A",
    "PROJECTOS-FINISH-EXTERNAL-PROOF2A",
    "PROJECTOS-FINISH-CONTINUE-INTEGRITY1A",
    "PROJECTOS-FINISH-EXTERNAL-PROOF3A",
    "PROJECTOS-COMPLETION1A",
    "PROJECTOS-KERNEL-CONTRACT1A",
    "PROJECTOS-KERNEL-ROLE-REVIEW1A",
    "PROJECTOS-KERNEL-COST-CAP1A",
    "PROJECTOS-KERNEL-PLATFORM-STOP1A",
    "PROJECTOS-KERNEL-TRUTH1A",
    "PROJECTOS-KERNEL-HYGIENE1A",
    "PROJECTOS-KERNEL-EXIT-PROOF1A",
    "PROJECTOS-KERNEL-FOLLOWUP1A"
  ],
  "blockedPhases": [],
  "deferredPhases": [],
  "acceptedCarryForward": [],
  "currentBranch": "projectos-autonomy-bootstrap1a",
  "currentHead": "183387a5c050bbae7a3cf021d77f0ff709334569",
  "currentRemoteHead": null,
  "workingTreeStatus": "clean",
  "currentRisks": [],
  "currentBlockers": [],
  "lastEvidenceReference": "plan-approval decision PLANDEC-c958d7514b26e968705c069d",
  "nextRecommendedPhase": "PROJECTOS-FINISH-WRITEPATHS1A",
  "lastUpdated": "2026-10-29T17:05:09.674Z",
  "updatedByRole": "gatekeeper"
}
