{
  "schemaVersion": "1.0.0",
  "projectId": "projectos",
  "activePlanId": "plan-f291febef5bc1625-52ee408cea18",
  "activePlanVersion": "1.13",
  "currentStatus": "PLAN READY",
  "completionMethod": "phase-closure",
  "acceptedPhaseCount": 0,
  "totalPhaseCount": 6,
  "completionPercentage": 0,
  "completedPhases": [],
  "activePhase": null,
  "pendingPhases": [
    "PROJECTOS-FINISH-WRITEPATHS1A",
    "PROJECTOS-FINISH-MULTIPROJECT1A",
    "PROJECTOS-FINISH-API-GATEKEEPER1A",
    "PROJECTOS-FINISH-EXTERNAL-PROOF1A",
    "PROJECTOS-FINISH-ZERO-TOUCH-CLOSURE1A",
    "PROJECTOS-FINISH-EXTERNAL-PROOF2A"
  ],
  "blockedPhases": [],
  "deferredPhases": [],
  "acceptedCarryForward": [],
  "currentBranch": "projectos-autonomy-bootstrap1a",
  "currentHead": "4b097b92cb2112d3290d0d21c851e30c2470a8bc",
  "currentRemoteHead": null,
  "workingTreeStatus": "dirty",
  "currentRisks": [],
  "currentBlockers": [],
  "lastEvidenceReference": "plan-approval decision PLANDEC-6d73d5b644a8ee3704ec74cd",
  "nextRecommendedPhase": "PROJECTOS-FINISH-WRITEPATHS1A",
  "lastUpdated": "2026-10-26T06:45:37.027Z",
  "updatedByRole": "gatekeeper"
}
