{
  "schemaVersion": "1.0.0",
  "projectId": "projectos",
  "activePlanId": "plan-7327e99e85028d90-83fc7b2a34a2",
  "activePlanVersion": "1.14",
  "currentStatus": "PLAN READY",
  "completionMethod": "phase-closure",
  "acceptedPhaseCount": 5,
  "totalPhaseCount": 6,
  "completionPercentage": 83.3,
  "completedPhases": [
    "PROJECTOS-FINISH-WRITEPATHS1A",
    "PROJECTOS-FINISH-MULTIPROJECT1A",
    "PROJECTOS-FINISH-API-GATEKEEPER1A",
    "PROJECTOS-FINISH-EXTERNAL-PROOF1A",
    "PROJECTOS-FINISH-ZERO-TOUCH-CLOSURE1A"
  ],
  "activePhase": null,
  "pendingPhases": [
    "PROJECTOS-FINISH-EXTERNAL-PROOF2A"
  ],
  "blockedPhases": [],
  "deferredPhases": [],
  "acceptedCarryForward": [],
  "currentBranch": "projectos-autonomy-bootstrap1a",
  "currentHead": "666ee326242f64dcdaa363b5d3400906eae4e82f",
  "currentRemoteHead": null,
  "workingTreeStatus": "dirty",
  "currentRisks": [],
  "currentBlockers": [],
  "lastEvidenceReference": "plan-approval decision PLANDEC-f31660754f7cde7b2780357b",
  "nextRecommendedPhase": "PROJECTOS-FINISH-EXTERNAL-PROOF2A",
  "lastUpdated": "2026-10-26T08:40:26.607Z",
  "updatedByRole": "owner"
}
