{
  "schemaVersion": "1.0.0",
  "projectId": "projectos",
  "activePlanId": "plan-ec03d3fa0fd70df2-b9b7236534c1",
  "activePlanVersion": "1.21",
  "currentStatus": "PLAN READY",
  "completionMethod": "phase-closure",
  "acceptedPhaseCount": 0,
  "totalPhaseCount": 18,
  "completionPercentage": 0,
  "completedPhases": [],
  "activePhase": null,
  "pendingPhases": [
    "PROJECTOS-FINISH-WRITEPATHS1A",
    "PROJECTOS-FINISH-MULTIPROJECT1A",
    "PROJECTOS-FINISH-API-GATEKEEPER1A",
    "PROJECTOS-FINISH-EXTERNAL-PROOF1A",
    "PROJECTOS-FINISH-ZERO-TOUCH-CLOSURE1A",
    "PROJECTOS-FINISH-EXTERNAL-PROOF2A",
    "PROJECTOS-FINISH-CONTINUE-INTEGRITY1A",
    "PROJECTOS-FINISH-EXTERNAL-PROOF3A",
    "PROJECTOS-COMPLETION1A",
    "PROJECTOS-KERNEL-CONTRACT1A",
    "PROJECTOS-KERNEL-ROLE-REVIEW1A",
    "PROJECTOS-KERNEL-COST-CAP1A",
    "PROJECTOS-KERNEL-PLATFORM-STOP1A",
    "PROJECTOS-KERNEL-TRUTH1A",
    "PROJECTOS-KERNEL-HYGIENE1A",
    "PROJECTOS-KERNEL-EXIT-PROOF1A",
    "PROJECTOS-KERNEL-FOLLOWUP1A",
    "PROJECTOS-KERNEL-CODEX-LIVE1A"
  ],
  "blockedPhases": [],
  "deferredPhases": [],
  "acceptedCarryForward": [],
  "currentBranch": "projectos-autonomy-bootstrap1a",
  "currentHead": "4de6e3263677e95754610fd06b18f6af55351dde",
  "currentRemoteHead": null,
  "workingTreeStatus": "clean",
  "currentRisks": [],
  "currentBlockers": [],
  "lastEvidenceReference": "plan-approval decision PLANDEC-385961f7b4bd086d7c2b70ee",
  "nextRecommendedPhase": "PROJECTOS-FINISH-WRITEPATHS1A",
  "lastUpdated": "2026-10-29T22:35:16.753Z",
  "updatedByRole": "gatekeeper"
}
