{
  "schemaVersion": "1.0.0",
  "projectId": "<project-id>",
  "activePlanId": "<plan-id>",
  "activePlanVersion": "1.0",
  "currentStatus": "PLAN DRAFTED",
  "completionMethod": "accepted-phase-ratio (temporary): acceptedPhaseCount / totalPhaseCount",
  "acceptedPhaseCount": 0,
  "totalPhaseCount": 1,
  "completionPercentage": 0,
  "completedPhases": [],
  "activePhase": null,
  "pendingPhases": ["<PHASE-ID>"],
  "blockedPhases": [],
  "deferredPhases": [],
  "acceptedCarryForward": [],
  "currentBranch": "<branch>",
  "currentHead": "0000000000000000000000000000000000000000",
  "currentRemoteHead": null,
  "workingTreeStatus": "clean",
  "currentRisks": [],
  "currentBlockers": [],
  "lastEvidenceReference": "",
  "nextRecommendedPhase": "<PHASE-ID>",
  "lastUpdated": "<YYYY-MM-DD>",
  "updatedByRole": "implementer"
}
